{
  "schema_version": "1.0",
  "session_id": "7e177f69-1d91-43ef-b554-d9529148f121",
  "created_at": "2026-09-09T10:30:00+08:00",
  "duration_ms": null,
  "status": "incomplete",
  "recording": {
    "video": {
    },
    "audio": {
    }
  },
  "events_file": "events.jsonl",
  "application": {
    "name": "Synthetic contract fixture",
    "version": "0.1.0"
  },
  "platform": {
    "os": "fixture",
    "architecture": "portable"
  }
}
